{
  "slug": "nascar-predictions",
  "name": "NASCAR Predictions",
  "sport": "NASCAR",
  "category": "stock",
  "maturity": "production",
  "summary": "Race, stage, and Chase championship forecasts for the NASCAR Cup Series.",
  "description": "Stock-car racing on the MotorsportVerse core: a field-relative driver-skill blend with per-track-type ratings (superspeedway, intermediate, short track, road course), attrition modeled as a first-class component of every forecast, and manufacturer effects. Title odds run through a format-aware championship simulator that encodes the 2026 Chase and the 2017-2025 elimination playoffs for historical backtesting, with the playoff projection gated on a passing seven-season backtest. Runs on the real 2026 Cup season: official results flow from NASCAR's public feeds into a committed, reviewable snapshot with per-stage results captured. Deployed site, scheduled refresh pipeline, and public forward-eval grading every round.",
  "repo": "https://github.com/roni-altshuler/motorsportverse/tree/main/projects/nascar-predictions",
  "website": "https://roni-altshuler.github.io/motorsportverse/projects/nascar/",
  "docs": "https://github.com/roni-altshuler/motorsportverse/tree/main/docs",
  "datasets": [
    "NASCAR official feeds (results + stages, snapshotted to committed files)",
    "Cup Series history 2018 onward (backfilled archive)"
  ],
  "models": [
    "driver-skill-elo",
    "track-type-ratings",
    "dnf-hazard-composition",
    "chase-championship-monte-carlo",
    "standings"
  ],
  "tags": [
    "stock-car",
    "ovals",
    "stage-racing",
    "chase-playoffs",
    "calibrated-probabilities",
    "monte-carlo"
  ],
  "icon": "/brand/sports/nascar.png",
  "accent": "#FFD659",
  "uses_core": [
    "calibration",
    "championship",
    "standings",
    "elo",
    "conformal",
    "eval",
    "drift",
    "promotion",
    "leakage",
    "interfaces"
  ],
  "maintainers": [],
  "added": "2026-06-15"
}
