{
  "slug": "indycar-predictions",
  "name": "IndyCar Predictions",
  "sport": "IndyCar",
  "category": "open-wheel",
  "maturity": "production",
  "summary": "Race and championship forecasts for the NTT IndyCar Series.",
  "description": "American open-wheel racing on the MotorsportVerse core, built snapshot-first: fifteen seasons of hand-verified historical data are the committed source of truth, and live updates land only behind strict parse-validation gates. The model's signature is a dual rating system that scores oval and road/street ability separately - validated to materially beat a single rating in walk-forward testing - alongside attrition modeling tuned to oval risk and Chevrolet/Honda engine effects. Covers the full 2026 season including the Indianapolis 500's 33-car field. Deployed site, scheduled refresh pipeline, and public forward-eval grading every round.",
  "repo": "https://github.com/roni-altshuler/motorsportverse/tree/main/projects/indycar-predictions",
  "website": "https://roni-altshuler.github.io/motorsportverse/projects/indycar/",
  "docs": "https://github.com/roni-altshuler/motorsportverse/tree/main/docs",
  "datasets": [
    "Hand-verified season archives 2012-2026 (committed, standings-checked)",
    "indycar.com / Wikipedia race classifications (validated refresh path)"
  ],
  "models": [
    "dual-surface-elo",
    "dnf-hazard-composition",
    "plackett-luce",
    "championship-monte-carlo",
    "standings"
  ],
  "tags": [
    "open-wheel",
    "ovals",
    "indy-500",
    "calibrated-probabilities",
    "monte-carlo"
  ],
  "icon": "/brand/sports/indycar.png",
  "accent": "#D31217",
  "uses_core": [
    "calibration",
    "championship",
    "standings",
    "elo",
    "conformal",
    "eval",
    "drift",
    "promotion",
    "leakage",
    "interfaces"
  ],
  "maintainers": [],
  "added": "2026-06-15"
}
